{
  "schema": "phoneme-decoder-request-0.1",
  "request_id": "synthetic-ambiguity-1",
  "kind": "ctc_probabilities",
  "vocabulary": [
    "<blank>",
    "AA",
    "AE",
    "AH",
    "AO",
    "AW",
    "AY",
    "B",
    "CH",
    "D",
    "DH",
    "EH",
    "ER",
    "EY",
    "F",
    "G",
    "HH",
    "IH",
    "IY",
    "JH",
    "K",
    "L",
    "M",
    "N",
    "NG",
    "OW",
    "OY",
    "P",
    "R",
    "S",
    "SH",
    "T",
    "TH",
    "UH",
    "UW",
    "V",
    "W",
    "Y",
    "Z",
    "ZH"
  ],
  "probabilities": [
    [
      0.05,
      0,
      0,
      0,
      0,
      0,
      0,
      0.35,
      0,
      0,
      0,
      0,
      0,
      0,
      0,
      0,
      0,
      0,
      0,
      0,
      0,
      0,
      0.05,
      0,
      0,
      0,
      0,
      0.55,
      0,
      0,
      0,
      0,
      0,
      0,
      0,
      0,
      0,
      0,
      0,
      0
    ],
    [
      0.9,
      0,
      0,
      0,
      0,
      0,
      0,
      0.05,
      0,
      0,
      0,
      0,
      0,
      0,
      0,
      0,
      0,
      0,
      0,
      0,
      0,
      0,
      0,
      0,
      0,
      0,
      0,
      0.05,
      0,
      0,
      0,
      0,
      0,
      0,
      0,
      0,
      0,
      0,
      0,
      0
    ],
    [
      0.02,
      0,
      0.95,
      0,
      0,
      0,
      0,
      0,
      0,
      0,
      0,
      0.03,
      0,
      0,
      0,
      0,
      0,
      0,
      0,
      0,
      0,
      0,
      0,
      0,
      0,
      0,
      0,
      0,
      0,
      0,
      0,
      0,
      0,
      0,
      0,
      0,
      0,
      0,
      0,
      0
    ],
    [
      0.95,
      0,
      0.05,
      0,
      0,
      0,
      0,
      0,
      0,
      0,
      0,
      0,
      0,
      0,
      0,
      0,
      0,
      0,
      0,
      0,
      0,
      0,
      0,
      0,
      0,
      0,
      0,
      0,
      0,
      0,
      0,
      0,
      0,
      0,
      0,
      0,
      0,
      0,
      0,
      0
    ],
    [
      0.02,
      0,
      0,
      0,
      0,
      0,
      0,
      0,
      0,
      0.03,
      0,
      0,
      0,
      0,
      0,
      0,
      0,
      0,
      0,
      0,
      0,
      0,
      0,
      0,
      0,
      0,
      0,
      0,
      0,
      0,
      0,
      0.95,
      0,
      0,
      0,
      0,
      0,
      0,
      0,
      0
    ]
  ],
  "step_times_ms": [
    0,
    40,
    80,
    120,
    160
  ],
  "observed_steps": [
    true,
    true,
    true,
    true,
    true
  ],
  "producer": {
    "model": {
      "id": "synthetic-not-a-checkpoint",
      "sha256": "cff42ed2ceb7eec2e0adab497a1ddffef91b09a691e426491120489cff15d5ae"
    },
    "preprocessing": {
      "id": "synthetic-40ms-steps",
      "sha256": "cff42ed2ceb7eec2e0adab497a1ddffef91b09a691e426491120489cff15d5ae"
    },
    "valid_steps": 5,
    "truncated_input": false
  },
  "calibration": {
    "status": "raw_softmax",
    "temperature": 1,
    "artifact": null
  },
  "resources": {
    "lexicon": {
      "id": "synthetic-pat-bat-mat",
      "sha256": "a91183adaa1d36e44583d43ec8edadfee01657c6b20a2cbf356042780dc351a4"
    },
    "language_model": null,
    "reranker": null
  },
  "search": {
    "phone_beam": 512,
    "lexical_beam": 128,
    "nbest": 5,
    "max_words": 128
  },
  "scoring": {
    "pronunciation_weight": 1,
    "lm_weight": 0,
    "word_insertion_bonus": 0,
    "reranker_weight": 0,
    "visual_score_window": 5
  }
}
